{
  "schema_version": 1,
  "agent_id": "agent.1",
  "scanner_version": "0.3.0",
  "hostname": "db-primary-01",
  "observed_at_unix_ms": 1790000000000,
  "capabilities": [],
  "health": {
    "queue": {
      "pending": 0,
      "oldest_pending_age_s": 0,
      "bytes": 81920,
      "max_bytes": 268435456,
      "dropped_total": 0,
      "rejected_total": {}
    },
    "last_scan": {
      "finished_at_unix_ms": 1790000000000,
      "interval_s": 3600,
      "rules_evaluated": 42,
      "rules_unavailable": 0,
      "rules_failed": 0,
      "collectors": {
        "packages": "ok"
      }
    },
    "rule_sets": [
      {
        "id": "baseline",
        "version": 7,
        "expires_at_unix_ms": 1790600000000,
        "refused": null
      },
      {
        "id": "hardening-linux-l1",
        "version": null,
        "expires_at_unix_ms": null,
        "refused": null,
        "state": "not_assigned"
      }
    ],
    "storage_errors": 0,
    "clock_jump_s": null
  }
}
